{
  "name": "Jain-1",
  "description": "",
  "stakeholder_label": "unspecified_stakeholder",
  "domain": null,
  "version": "0.3.0",
  "schema_version": "DEMEProfileV03-0.1",
  "principlism": {
    "beneficence": 0.32258064516129026,
    "non_maleficence": 0.33870967741935476,
    "autonomy": 0.11290322580645161,
    "justice": 0.22580645161290322
  },
  "trustworthiness": {
    "valid_reliable": 0.1575757575757576,
    "safe": 0.27272727272727276,
    "secure_resilient": 0.1090909090909091,
    "accountable_transparent": 0.1090909090909091,
    "explainable_interpretable": 0.0787878787878788,
    "privacy_enhanced": 0.09090909090909093,
    "fair_bias_managed": 0.18181818181818185
  },
  "deme_dimensions": {
    "safety": 0.34615384615384615,
    "autonomy_respect": 0.07692307692307693,
    "fairness_equity": 0.23076923076923078,
    "privacy_confidentiality": 0.11538461538461539,
    "environment_societal": 0.07692307692307693,
    "rule_following_legality": 0.07692307692307693,
    "priority_for_vulnerable": 0.07692307692307693,
    "trust_relationships": 0.05
  },
  "risk_attitude": {
    "appetite": "risk_averse",
    "max_overall_risk": 0.2,
    "tolerances": {
      "safety": 0.1,
      "rights": 0.05,
      "fairness": 0.15,
      "privacy": 0.15,
      "information_integrity": 0.2,
      "security_resilience": 0.2,
      "environmental": 0.2
    },
    "escalate_near_threshold": true,
    "escalation_margin": 0.05
  },
  "override_mode": "rights_first",
  "lexical_layers": [
    {
      "name": "rights_and_duties",
      "principles": [
        "autonomy",
        "rights",
        "rule_following_legality"
      ],
      "hard_stop": true,
      "context_condition": null
    },
    {
      "name": "welfare",
      "principles": [
        "safety",
        "priority_for_vulnerable"
      ],
      "hard_stop": false,
      "context_condition": null
    },
    {
      "name": "justice_and_commons",
      "principles": [
        "fairness",
        "environment"
      ],
      "hard_stop": false,
      "context_condition": null
    }
  ],
  "override_graph": [
    {
      "higher": "non_maleficence",
      "lower": "autonomy",
      "context_condition": "consequences.urgency >= 0.95 && epistemic_status.uncertainty_level <= 0.4",
      "strength": 0.9
    }
  ],
  "hard_vetoes": {
    "never_catastrophic_safety_harm": true,
    "never_intentional_serious_harm": true,
    "never_discriminate_protected_groups": true,
    "never_violate_explicit_consent": true,
    "never_systematic_privacy_violation": true,
    "never_mass_surveillance_private_spaces": true,
    "never_persistent_misinfo_disinfo_campaigns": true,
    "never_child_sexual_abuse_or_exploitative_content": true,
    "never_illegal_content_even_if_utility_high": true,
    "never_needless_harm_to_non_human_life": true,
    "never_fabricate_critical_evidence": true,
    "never_impersonate_real_person_without_consent": true
  },
  "pattern_constraints": [
    {
      "name": "forbid_high_expected_harm",
      "kind": "forbid_when",
      "expression": "consequences.expected_harm >= 0.8",
      "rationale": "Avoid options with very high expected serious harm."
    },
    {
      "name": "forbid_protected_attr_discrimination",
      "kind": "forbid_when",
      "expression": "justice_and_fairness.discriminates_on_protected_attr == true",
      "rationale": "Do not discriminate on protected attributes."
    },
    {
      "name": "avoid_needless_non_human_harm",
      "kind": "forbid_when",
      "expression": "societal_and_environmental.harms_non_human_life == true && societal_and_environmental.reasonable_alternative_available == true",
      "rationale": "Avoid needless harm to non-human life when a reasonable alternative exists."
    }
  ],
  "governance_expectations": {
    "expects_govern_function": true,
    "expects_map_function": true,
    "expects_measure_function": true,
    "expects_manage_function": true,
    "requires_documented_risk_register": true,
    "requires_incident_reporting_process": true,
    "requires_human_oversight_roles_defined": true,
    "requires_tevv_for_high_risk_use": true,
    "ai_rmf_profile_id": null
  },
  "base_em_ids": [
    "geneva_baseline"
  ],
  "base_em_enforcement": "hard_veto",
  "tags": [
    "domestic",
    "clinical",
    "generic"
  ],
  "notes": "This profile is inspired by Jain ethics, especially ..."
}